{
  "apiVersion": "capability.interface.ai.local/v1",
  "id": "lookup-savings-balance",
  "name": "Lookup member savings balance",
  "version": "1",
  "description": "Open Core Inquiry, look up a member by ID, return current savings balance.",
  "app": {
    "surface": "web",
    "entry": "/",
    "origin_allowlist": ["http://127.0.0.1"]
  },
  "input_schema": {
    "type": "object",
    "required": ["member_id"],
    "properties": {
      "member_id": { "type": "string", "pattern": "^[0-9]+$" }
    }
  },
  "output_schema": {
    "type": "object",
    "properties": {
      "member_name": { "type": "string" },
      "savings_balance": { "type": "string" }
    }
  },
  "risk": "safe",
  "checkpoint": {
    "kind": "role_name_visible",
    "role": "heading",
    "name": "Member Profile"
  },
  "known_outcomes": [
    {
      "code": "member_not_found",
      "detect": { "kind": "text_visible", "text": "Record not found" }
    }
  ],
  "steps": [
    {
      "id": "s1",
      "action": "fill",
      "target": {
        "frame": "content",
        "strategies": [
          { "strategy": "role", "role": "textbox", "name": "Member ID" },
          { "strategy": "nearby_text", "text": "Member ID" }
        ]
      },
      "input_binding": { "from": "input", "key": "member_id" }
    },
    {
      "id": "s2",
      "action": "click",
      "target": {
        "frame": "content",
        "strategies": [
          { "strategy": "role", "role": "button", "name": "Inquiry" }
        ]
      }
    },
    {
      "id": "s3",
      "action": "extract",
      "target": {
        "frame": "content",
        "strategies": [
          { "strategy": "nearby_text", "text": "Savings balance" }
        ]
      },
      "output_binding": { "key": "savings_balance" }
    }
  ]
}
